{
  "schema": "agent-receipt-policy",
  "id": "default-receipt-policy",
  "lifecycle": "accepted",
  "ownedBy": "contracts/agent-governance/",
  "storage": {
    "transientDirectory": ".agent-runs/",
    "promotedDirectory": "docs/audits/",
    "maxReceiptBytes": 50000
  },
  "privacy": {
    "forbidSecrets": true,
    "forbidFullTranscripts": true,
    "forbidEnvironmentDumps": true,
    "redactPatterns": ["secret", "token"]
  },
  "requiredFields": ["request", "assignment", "route", "commands", "verificationEvidence", "changes", "final"],
  "promotion": {
    "requiresHumanReview": true,
    "requiresAuditReason": true
  }
}
